{"$schema":"https://json-schema.org/draft/2020-12/schema","$id":"https://thedailyline.bet/schemas/video/v1/asset-manifest.schema.json","title":"AssetManifest","type":"object","additionalProperties":false,"required":["schema_version","asset_manifest_id","assets","created_at","manifest_digest"],"properties":{"schema_version":{"const":"asset-manifest.v1"},"asset_manifest_id":{"$ref":"common.schema.json#/$defs/Id"},"assets":{"type":"array","items":{"$ref":"#/$defs/ResolvedAsset"}},"created_at":{"$ref":"common.schema.json#/$defs/Timestamp"},"manifest_digest":{"$ref":"common.schema.json#/$defs/Digest"}},"$defs":{"ResolvedAsset":{"type":"object","additionalProperties":false,"required":["asset_id","slot_id","source_class","uri_or_artifact_ref","content_hash","media_type","origin_provider_ref","origin_record_ref","license_or_rights_ref","allowed_platforms","territories","use_classes","attribution_requirement","generated_metadata","policy_status","documentary_status","parent_asset_refs"],"properties":{"asset_id":{"$ref":"common.schema.json#/$defs/Id"},"slot_id":{"$ref":"common.schema.json#/$defs/Ref"},"source_class":{"enum":["owned","licensed","generated","stock","public_domain","platform_supplied","data_visualization"]},"uri_or_artifact_ref":{"$ref":"common.schema.json#/$defs/Ref"},"content_hash":{"$ref":"common.schema.json#/$defs/Digest"},"media_type":{"type":"string","minLength":1},"width":{"type":["integer","null"],"minimum":1},"height":{"type":["integer","null"],"minimum":1},"duration_ms":{"type":["integer","null"],"minimum":0},"origin_provider_ref":{"$ref":"common.schema.json#/$defs/Ref"},"origin_record_ref":{"$ref":"common.schema.json#/$defs/Ref"},"license_or_rights_ref":{"$ref":"common.schema.json#/$defs/Ref"},"allowed_platforms":{"$ref":"common.schema.json#/$defs/StringSet"},"territories":{"$ref":"common.schema.json#/$defs/StringSet"},"use_classes":{"$ref":"common.schema.json#/$defs/StringSet"},"expiry":{"oneOf":[{"$ref":"common.schema.json#/$defs/Timestamp"},{"type":"null"}]},"attribution_requirement":{"type":["string","null"]},"generated_metadata":{"oneOf":[{"$ref":"#/$defs/GeneratedMetadata"},{"type":"null"}]},"policy_status":{"enum":["PASS","FAIL","REVIEW_REQUIRED"]},"documentary_status":{"enum":["authentic_documentary","illustrative_generic","data_visualization","brand_owned"]},"parent_asset_refs":{"$ref":"common.schema.json#/$defs/RefSet"}}},"GeneratedMetadata":{"type":"object","additionalProperties":false,"required":["provider_ref","model_ref","prompt_template_ref","resolved_prompt_digest","generation_timestamp"],"properties":{"provider_ref":{"$ref":"common.schema.json#/$defs/Ref"},"model_ref":{"$ref":"common.schema.json#/$defs/Ref"},"prompt_template_ref":{"$ref":"common.schema.json#/$defs/Ref"},"resolved_prompt_digest":{"$ref":"common.schema.json#/$defs/Digest"},"seed_or_provider_generation_ref":{"type":["string","null"]},"generation_timestamp":{"$ref":"common.schema.json#/$defs/Timestamp"},"safety_or_policy_receipt_ref":{"type":["string","null"]}}}}}
