{"schema_version":"asset-manifest.v1","asset_manifest_id":"assetmanifest.mlb.sf-lad.1a","assets":[{"asset_id":"asset.hero.generated.001","slot_id":"asset.hero","source_class":"generated","uri_or_artifact_ref":"artifact://images/baseball-stadium-generic-001.webp","content_hash":"sha256:59a63a93599ade07a465e0ab482af6e0120551c1af21584b7fe9ca6bbc1effaa","media_type":"image/webp","width":1080,"height":1920,"duration_ms":null,"origin_provider_ref":"image-provider.fixture","origin_record_ref":"generation.fixture.001","license_or_rights_ref":"rights.generated-commercial.v1","allowed_platforms":["tiktok","instagram_reels","youtube_shorts"],"territories":["US"],"use_classes":["organic_social"],"expiry":"2027-09-08T00:00:00Z","attribution_requirement":null,"generated_metadata":{"provider_ref":"image-provider.fixture","model_ref":"image-model.fixture","prompt_template_ref":"generic-baseball-background.v1","resolved_prompt_digest":"sha256:cf07194ee232eb531e15f690000d19846dea69cf05504782658afcfacb9228a2","seed_or_provider_generation_ref":"seed-1","generation_timestamp":"2026-09-08T16:07:00Z","safety_or_policy_receipt_ref":"policy-receipt.fixture.001"},"policy_status":"PASS","documentary_status":"illustrative_generic","parent_asset_refs":[]},{"asset_id":"asset.data-bg.001","slot_id":"asset.data-bg","source_class":"owned","uri_or_artifact_ref":"artifact://brand/data-grid-v1.svg","content_hash":"sha256:48e13c1eb5ecd4e19f56ce4cf246f1082fc3c26b42e927d776fdc2c4316fcb65","media_type":"image/svg+xml","width":1080,"height":1920,"duration_ms":null,"origin_provider_ref":"one-village","origin_record_ref":"brand-release@1.0.0","license_or_rights_ref":"rights.first-party.v1","allowed_platforms":["tiktok","instagram_reels","youtube_shorts"],"territories":["US"],"use_classes":["organic_social"],"expiry":null,"attribution_requirement":null,"generated_metadata":null,"policy_status":"PASS","documentary_status":"brand_owned","parent_asset_refs":[]}],"created_at":"2026-09-08T16:08:00Z","manifest_digest":"sha256:7d95551e208353235278647cbe6359d32671270de9e8a32d13f3d2c9df3da752"}
